{
  "schemaVersion": 1,
  "mode": "check",
  "authority": "local-feedback",
  "runId": "1e449dbbc8eb4875ef1da811",
  "startedAt": "2026-09-24T14:22:04.650876Z",
  "finishedAt": "2026-09-24T14:22:05.318687Z",
  "current": true,
  "subject": {
    "repoRoot": "/synthetic/pilot",
    "baselineCommit": "synthetic-baseline",
    "comparisonBase": "synthetic-baseline",
    "head": "synthetic-baseline",
    "mergeBase": "synthetic-baseline",
    "snapshotDigest": "sha256:f34bb4c27c344d81e967c8020f6fd1248807195329dade36363245c6f286869a",
    "excludedCategories": [
      "git metadata",
      "dependency and generated output",
      "environment and credential/private-key files",
      "ignored untracked files",
      "source npmrc (identity only; generated safe config used)"
    ],
    "changedPaths": [],
    "outOfScopePaths": []
  },
  "policy": {
    "packageDigest": "c1b2f57209315b60752f66685d9bc71b267806479bb9bbc5faec9a00b69fe951",
    "profileDigest": "63af40ac90bd95cef6a56a7696b291e8dbb511a7dbb3b4dab56c2087b58c4fec",
    "baselineCommit": "synthetic-baseline"
  },
  "runtime": {
    "evaluatorDigest": "b2f75ccf2575da4543ecec646194ae2f5a476fdf810681b04d01042b8e73ff18",
    "evaluatorVersion": "Conftest: dev\nOPA: 1.20.2",
    "runnerImageId": "",
    "preparationInputDigest": ""
  },
  "scope": {
    "profile": "frontend-vitest",
    "deferred": [
      "artifact verification at trusted build/release",
      "vulnerability and license assessment"
    ],
    "excluded": [
      "backend",
      "hosted LLM",
      "E2E, browser and visual tests",
      "deployment and infrastructure",
      "branch protection verification",
      "compliance certification",
      "test adequacy and business acceptance",
      "release authorization",
      "remote refs are not refreshed"
    ]
  },
  "findings": [
    {
      "controlId": "ci.integrity",
      "status": "pass",
      "reasonCode": "protected_workflow_unchanged",
      "message": "Protected semantic workflow objects and all baseline gate dependencies are preserved.",
      "paths": [],
      "evidence": [],
      "owner": "frontend-maintainer",
      "nextActions": []
    },
    {
      "controlId": "eer.tests",
      "status": "missing",
      "reasonCode": "preparation_required",
      "message": "No compatible preparation receipt. Run preflight prepare --state-dir /private/preflight-state --allow-downloads.",
      "paths": [],
      "evidence": [],
      "owner": "frontend-maintainer",
      "nextActions": [
        {
          "description": "Prepare dependencies explicitly",
          "command": "preflight",
          "args": [
            "prepare",
            "--state-dir",
            "/private/preflight-state",
            "--allow-downloads"
          ]
        }
      ]
    },
    {
      "controlId": "npm.dependencies",
      "status": "pass",
      "reasonCode": "dependency_declarations_accepted",
      "message": "Complete npm lockfile declarations and existing compatibility overrides satisfy the pinned bounded policy; vulnerability and license assessment are excluded.",
      "paths": [],
      "evidence": [],
      "owner": "frontend-maintainer",
      "nextActions": []
    },
    {
      "controlId": "artifact.verification",
      "status": "deferred",
      "reasonCode": "trusted_build_required",
      "message": "Artifact contents and provenance require verification at a trusted build/release stage. Local feedback is not release authorization.",
      "paths": [],
      "evidence": [],
      "owner": "frontend-maintainer",
      "nextActions": []
    }
  ],
  "summary": {
    "pass": 2,
    "fail": 0,
    "missing": 1,
    "error": 0,
    "review_required": 0,
    "deferred": 1,
    "not_applicable": 0
  },
  "exitCode": 2
}
